[
  {
    "id": "plan:eerste-kamer-2026-09-25",
    "organization": "org:eerste-kamer",
    "asOf": "2026-09-25",
    "coordinates": "grid",
    "seatBasis": "person",
    "seats": [
      {
        "x": 0,
        "y": 0,
        "fractie": "SP",
        "person": "person:r-van-aelst-den-uijl-ma",
        "block": "left"
      },
      {
        "x": 1,
        "y": 0,
        "fractie": "SP",
        "person": "person:prof-dr-e-b-van-apeldoorn",
        "block": "left"
      },
      {
        "x": 2,
        "y": 0,
        "fractie": "SP",
        "person": "person:mr-r-a-janssen",
        "block": "left"
      },
      {
        "x": 0,
        "y": 1,
        "fractie": "VVD",
        "person": "person:s-t-musa",
        "block": "left"
      },
      {
        "x": 1,
        "y": 1,
        "fractie": "PvdD",
        "person": "person:drs-n-k-koffeman",
        "block": "left"
      },
      {
        "x": 2,
        "y": 1,
        "fractie": "PvdD",
        "person": "person:prof-mr-p-nicolai",
        "block": "left"
      },
      {
        "x": 0,
        "y": 2,
        "fractie": "VVD",
        "person": "person:mr-m-n-j-van-der-linden",
        "block": "left"
      },
      {
        "x": 1,
        "y": 2,
        "fractie": "VVD",
        "person": "person:drs-k-petersen",
        "block": "left"
      },
      {
        "x": 2,
        "y": 2,
        "fractie": "VVD",
        "person": "person:drs-k-c-j-straus",
        "block": "left"
      },
      {
        "x": 3,
        "y": 2,
        "fractie": "VVD",
        "person": "person:drs-h-j-meijer",
        "block": "left"
      },
      {
        "x": 0,
        "y": 3,
        "fractie": "VVD",
        "person": "person:dr-m-j-kaljouw",
        "block": "left"
      },
      {
        "x": 1,
        "y": 3,
        "fractie": "VVD",
        "person": "person:mr-h-w-vogels",
        "block": "left"
      },
      {
        "x": 2,
        "y": 3,
        "fractie": "VVD",
        "person": "person:w-t-van-ballekom",
        "block": "left"
      },
      {
        "x": 3,
        "y": 3,
        "fractie": "VVD",
        "person": "person:drs-t-klip-martin",
        "block": "left"
      },
      {
        "x": 0,
        "y": 4,
        "fractie": "PVV",
        "person": "person:a-j-m-van-kesteren",
        "block": "left"
      },
      {
        "x": 1,
        "y": 4,
        "fractie": "PVV",
        "person": "person:mr-i-a-bezaan",
        "block": "left"
      },
      {
        "x": 2,
        "y": 4,
        "fractie": "PVV",
        "person": "person:ir-drs-g-a-van-strien",
        "block": "left"
      },
      {
        "x": 3,
        "y": 4,
        "fractie": "PVV",
        "person": "person:a-w-j-a-van-hattem",
        "block": "left"
      },
      {
        "x": 0,
        "y": 5,
        "fractie": "BBB",
        "person": "person:w-c-p-h-jaspers",
        "block": "left"
      },
      {
        "x": 1,
        "y": 5,
        "fractie": "BBB",
        "person": "person:a-p-m-van-wijk",
        "block": "left"
      },
      {
        "x": 2,
        "y": 5,
        "fractie": "JA21",
        "person": "person:dr-r-baumgarten",
        "block": "left"
      },
      {
        "x": 3,
        "y": 5,
        "fractie": "JA21",
        "person": "person:mr-k-van-bijsterveld",
        "block": "left"
      },
      {
        "x": 0,
        "y": 6,
        "fractie": "BBB",
        "person": "person:em-prof-dr-f-van-knapen",
        "block": "left"
      },
      {
        "x": 1,
        "y": 6,
        "fractie": "BBB",
        "person": "person:r-lievense",
        "block": "left"
      },
      {
        "x": 2,
        "y": 6,
        "fractie": "BBB",
        "person": "person:drs-a-van-langen-visbeek",
        "block": "left"
      },
      {
        "x": 3,
        "y": 6,
        "fractie": "BBB",
        "person": "person:i-m-lagas-mdr",
        "block": "left"
      },
      {
        "x": 0,
        "y": 7,
        "fractie": "BBB",
        "person": "person:mr-h-a-marquart-scholtz",
        "block": "left"
      },
      {
        "x": 1,
        "y": 7,
        "fractie": "BBB",
        "person": "person:ing-m-j-l-goossen",
        "block": "left"
      },
      {
        "x": 2,
        "y": 7,
        "fractie": "BBB",
        "person": "person:drs-ing-b-kroon",
        "block": "left"
      },
      {
        "x": 3,
        "y": 7,
        "fractie": "BBB",
        "person": "person:drs-ing-t-panman",
        "block": "left"
      },
      {
        "x": 0,
        "y": 8,
        "fractie": "BBB",
        "person": "person:g-j-oplaat",
        "block": "left"
      },
      {
        "x": 1,
        "y": 8,
        "fractie": "Fractie-Van de Sanden",
        "person": "person:mr-c-a-h-van-de-sanden-ll-m",
        "block": "left"
      },
      {
        "x": 2,
        "y": 8,
        "fractie": "Fractie-Visseren-Hamakers",
        "person": "person:prof-dr-i-j-visseren-hamakers",
        "block": "left"
      },
      {
        "x": 3,
        "y": 8,
        "fractie": "50PLUS",
        "person": "person:drs-m-j-van-rooijen",
        "block": "left"
      },
      {
        "x": 0,
        "y": 9,
        "fractie": "Fractie-Van Gasteren",
        "person": "person:mr-r-m-j-van-gasteren-llm",
        "block": "left"
      },
      {
        "x": 1,
        "y": 9,
        "fractie": "Fractie-Beukering",
        "person": "person:bgen-b-d-drs-a-j-a-beukering",
        "block": "left"
      },
      {
        "x": 2,
        "y": 9,
        "fractie": "Fractie-Walenkamp",
        "person": "person:drs-p-v-a-walenkamp-ma",
        "block": "left"
      },
      {
        "x": 3,
        "y": 9,
        "fractie": "OPNL",
        "person": "person:drs-a-sj-van-der-goot",
        "block": "left"
      },
      {
        "x": 6,
        "y": 0,
        "fractie": "FVD",
        "person": "person:j-dessing",
        "block": "right"
      },
      {
        "x": 7,
        "y": 0,
        "fractie": "FVD",
        "person": "person:j-c-m-van-den-oetelaar",
        "block": "right"
      },
      {
        "x": 8,
        "y": 0,
        "fractie": "FVD",
        "person": "person:drs-e-kemperman-mba",
        "block": "right"
      },
      {
        "x": 6,
        "y": 1,
        "fractie": "D66",
        "person": "person:a-kanis",
        "block": "right"
      },
      {
        "x": 7,
        "y": 1,
        "fractie": "D66",
        "person": "person:ir-ing-c-p-m-moonen",
        "block": "right"
      },
      {
        "x": 8,
        "y": 1,
        "fractie": "D66",
        "person": "person:drs-a-griffioen",
        "block": "right"
      },
      {
        "x": 5,
        "y": 2,
        "fractie": "D66",
        "person": "person:drs-p-h-van-meenen",
        "block": "right"
      },
      {
        "x": 6,
        "y": 2,
        "fractie": "D66",
        "person": "person:m-karaaslan-mmc",
        "block": "right"
      },
      {
        "x": 7,
        "y": 2,
        "fractie": "D66",
        "person": "person:mr-b-o-dittrich",
        "block": "right"
      },
      {
        "x": 8,
        "y": 2,
        "fractie": "D66",
        "person": "person:mr-r-s-croll",
        "block": "right"
      },
      {
        "x": 5,
        "y": 3,
        "fractie": "SGP",
        "person": "person:p-schalk",
        "block": "right"
      },
      {
        "x": 6,
        "y": 3,
        "fractie": "SGP",
        "person": "person:prof-dr-m-j-de-vries",
        "block": "right"
      },
      {
        "x": 7,
        "y": 3,
        "fractie": "CDA",
        "person": "person:mr-drs-h-doornhof",
        "block": "right"
      },
      {
        "x": 8,
        "y": 3,
        "fractie": "CDA",
        "person": "person:dr-mr-j-bakker-klein",
        "block": "right"
      },
      {
        "x": 5,
        "y": 4,
        "fractie": "CDA",
        "person": "person:drs-t-j-f-m-bovens",
        "block": "right"
      },
      {
        "x": 6,
        "y": 4,
        "fractie": "CDA",
        "person": "person:dr-m-m-van-toorenburg",
        "block": "right"
      },
      {
        "x": 7,
        "y": 4,
        "fractie": "CDA",
        "person": "person:drs-th-w-rietkerk",
        "block": "right"
      },
      {
        "x": 8,
        "y": 4,
        "fractie": "CDA",
        "person": "person:mr-drs-j-p-m-steenkamp",
        "block": "right"
      },
      {
        "x": 5,
        "y": 5,
        "fractie": "ChristenUnie",
        "person": "person:j-c-huizinga-heringa",
        "block": "right"
      },
      {
        "x": 6,
        "y": 5,
        "fractie": "ChristenUnie",
        "person": "person:mr-h-j-j-talsma",
        "block": "right"
      },
      {
        "x": 7,
        "y": 5,
        "fractie": "ChristenUnie",
        "person": "person:drs-f-w-j-holterhues",
        "block": "right"
      },
      {
        "x": 8,
        "y": 5,
        "fractie": "PRO",
        "person": "person:dr-d-m-g-roovers",
        "block": "right"
      },
      {
        "x": 5,
        "y": 6,
        "fractie": "PRO",
        "person": "person:p-rosenmoller",
        "block": "right"
      },
      {
        "x": 6,
        "y": 6,
        "fractie": "PRO",
        "person": "person:mr-j-recourt",
        "block": "right"
      },
      {
        "x": 7,
        "y": 6,
        "fractie": "PRO",
        "person": "person:drs-h-a-m-janssen-van-helvoort",
        "block": "right"
      },
      {
        "x": 8,
        "y": 6,
        "fractie": "PRO",
        "person": "person:drs-f-j-m-crone",
        "block": "right"
      },
      {
        "x": 5,
        "y": 7,
        "fractie": "PRO",
        "person": "person:drs-s-m-kluit",
        "block": "right"
      },
      {
        "x": 6,
        "y": 7,
        "fractie": "PRO",
        "person": "person:f-karimi",
        "block": "right"
      },
      {
        "x": 7,
        "y": 7,
        "fractie": "PRO",